{
  "$schema": "https://systems-phd-explorer.local/schemas/v1/relevance.schema.json",
  "schema_version": "1.0.0",
  "paper_id": "asplos-2023-transparent-runtime-change-handling-for-android-apps-49d315c9",
  "class": "CORE_SYSTEMS",
  "score": 4,
  "rationale": "Core systems fit because the paper contributes a concrete mobile, edge, or embedded-system mechanism for transparent Runtime Change Handling for Android Apps.",
  "topics": [
    "mobile-edge-embedded-and-iot",
    "mobile-systems",
    "edge-computing",
    "embedded-systems",
    "internet-of-things"
  ],
  "system_layers": [
    "hardware",
    "runtime",
    "application-infrastructure"
  ],
  "contribution_types": [
    "new-system"
  ],
  "methods": [
    "implementation"
  ],
  "sources": [
    {
      "id": "src-asplos-2023-program",
      "url": "https://asplos-conference.org/asplos2023/index.html%3Fp%3D3602.html",
      "kind": "conference-program",
      "title": "Program – ASPLOS 2023",
      "publisher": "ASPLOS",
      "retrieved_at": "2026-07-30T02:00:48Z",
      "content_hash": "sha256:b1f7ebd4f5650ff7bf1046a1bb8140dba70b237cd7059fe48a600e85d9e05435",
      "official": true,
      "supports": [
        "Conference dates, 27 numbered technical sessions, canonical displayed titles, ordered displayed authors, DOI links, and paper-level lightning-talk links."
      ]
    },
    {
      "id": "src-semantic-scholar-3582016-3582060",
      "url": "https://www.semanticscholar.org/paper/b9b2b38922f5363e847d69bbad11b254bd0fb20b",
      "kind": "semantic-scholar",
      "title": "Transparent Runtime Change Handling for Android Apps",
      "publisher": "Semantic Scholar",
      "retrieved_at": "2026-07-30T02:00:48Z",
      "content_hash": "sha256:ea3c6c8590dc0b777d3ece07203b8af1c16ff72376ece5072b2e54611c4b0efd",
      "official": false,
      "supports": [
        "Indexed abstract used with the official technical-session context for relevance classification, plus alternate-copy and explicitly printed ancillary links."
      ]
    }
  ],
  "workflow": {
    "status": "READY_FOR_REVIEW",
    "owner": "agent-c",
    "updated_at": "2026-07-30T02:00:48Z",
    "notes": [
      "Classified from the official ASPLOS technical session and the complete abstract indexed by Semantic Scholar; no official conference abstract page was available, and independent review is still required."
    ]
  },
  "verification": {
    "collected_at": "2026-07-30T02:00:48Z",
    "last_verified_at": "2026-07-30T02:00:48Z",
    "collector_version": "agent-c-asplos-2023/1.0",
    "confidence": "HIGH",
    "verified_by": "agent-c",
    "unresolved_fields": []
  }
}
