{
  "$schema": "https://systems-phd-explorer.local/schemas/v1/relevance.schema.json",
  "schema_version": "1.0.0",
  "paper_id": "usenix-security-2023-kextfuzz-fuzzing-macos-kernel-extensions-on-apple-silico-c4054586",
  "class": "SYSTEMS_ADJACENT",
  "score": 3,
  "rationale": "The paper contributes a operating-system and kernel security attack, analysis, or testing artifact with material systems relevance, but its primary contribution is security analysis rather than a new systems design.",
  "topics": [
    "operating-systems-and-kernels",
    "systems-security",
    "networking",
    "network-security",
    "reliability-testing-and-debugging",
    "vulnerability-discovery",
    "fuzzing",
    "bug-finding"
  ],
  "system_layers": [
    "kernel",
    "network"
  ],
  "contribution_types": [
    "new-system",
    "bug-finding-or-testing-tool",
    "deployment-experience",
    "security-attack",
    "defense"
  ],
  "methods": [
    "static-analysis",
    "fuzzing"
  ],
  "sources": [
    {
      "id": "src-1526c32586d2ec9b-paper",
      "url": "https://www.usenix.org/conference/usenixsecurity23/presentation/yin",
      "kind": "paper-page",
      "title": "KextFuzz: Fuzzing macOS Kernel EXTensions on Apple Silicon via Exploiting Mitigations",
      "publisher": "USENIX Association",
      "retrieved_at": "2026-07-30T01:39:19Z",
      "content_hash": null,
      "official": true,
      "supports": [
        "official abstract used for strict systems-relevance screening"
      ]
    }
  ],
  "workflow": {
    "status": "READY_FOR_REVIEW",
    "owner": "agent-d",
    "updated_at": "2026-07-30T01:39:19Z",
    "notes": [
      "Strict systems-relevance screening uses the paper's available abstract and contribution, not venue membership."
    ]
  },
  "verification": {
    "collected_at": "2026-07-30T01:39:19Z",
    "last_verified_at": "2026-07-30T01:39:19Z",
    "collector_version": "agent-d-strict-systems-screen/1.2-paper-review",
    "confidence": "MEDIUM",
    "verified_by": "agent-d",
    "unresolved_fields": []
  }
}
