{
  "$schema": "https://systems-phd-explorer.local/schemas/v1/relevance.schema.json",
  "schema_version": "1.0.0",
  "paper_id": "nsdi-2023-netpanel-traffic-measurement-of-exchange-online-service-5e14e236",
  "class": "CORE_SYSTEMS",
  "score": 4,
  "rationale": "The official abstract contributes a concrete network measurement method, operational system, or empirically grounded systems insight, so it is core systems work.",
  "topics": [
    "networking",
    "rdma",
    "cloud-and-datacenter-systems",
    "datacenter-systems",
    "computer-architecture",
    "hardware-software-co-design",
    "measurement-and-empirical-systems-studies",
    "production-measurement"
  ],
  "system_layers": [
    "hardware",
    "distributed-service",
    "application-infrastructure",
    "network"
  ],
  "contribution_types": [
    "new-system",
    "new-mechanism",
    "measurement-study",
    "deployment-experience"
  ],
  "methods": [
    "implementation",
    "trace-analysis",
    "production-deployment"
  ],
  "sources": [
    {
      "id": "src-nsdi23-program",
      "url": "https://www.usenix.org/conference/nsdi23/technical-sessions",
      "kind": "conference-program",
      "title": "NSDI '23 Technical Sessions",
      "publisher": "USENIX Association",
      "retrieved_at": "2026-07-30T00:08:09Z",
      "content_hash": "sha256:cac988a2e147b34e6feb8a05e8f68f38cb1693eb619fcc375b24235686fe8610",
      "official": true,
      "supports": [
        "complete archival main-track enumeration and non-paper boundaries",
        "paper titles, sessions or tracks, abstracts, and displayed author affiliations",
        "official artifact badges where displayed"
      ]
    },
    {
      "id": "src-nsdi-2023-netpanel-traffic-measurement-of-exchange-online-service-5e14e236-paper-page",
      "url": "https://www.usenix.org/conference/nsdi23/presentation/chen-yu",
      "kind": "paper-page",
      "title": "NetPanel: Traffic Measurement of Exchange Online Service",
      "publisher": "USENIX Association",
      "retrieved_at": "2026-07-30T00:08:09Z",
      "content_hash": "sha256:c2e803f897837c5545dbc3f4b95d3de395c03377d0b42ca129f38b61f479d9e9",
      "official": true,
      "supports": [
        "canonical title and abstract",
        "ordered authors and publication-time affiliations except where an explicitly cited paper PDF resolves a metadata conflict",
        "official paper page and PDF",
        "proceedings page range",
        "official BibTeX",
        "presentation media links"
      ]
    }
  ],
  "workflow": {
    "status": "READY_FOR_REVIEW",
    "owner": "agent-b",
    "updated_at": "2026-07-30T00:08:09Z",
    "notes": [
      "Classification is corpus fit, not a quality, impact, advisor, or prestige judgment.",
      "Classification uses the official title, session or track, and abstract under inclusion-policy v1."
    ]
  },
  "verification": {
    "collected_at": "2026-07-29T23:36:36Z",
    "last_verified_at": "2026-07-30T00:08:09Z",
    "collector_version": "agent-b-official-program-collector/1.1",
    "confidence": "HIGH",
    "verified_by": "agent-b",
    "unresolved_fields": []
  }
}
