{
  "$schema": "https://systems-phd-explorer.local/schemas/v1/relevance.schema.json",
  "schema_version": "1.0.0",
  "paper_id": "usenix-security-2024-take-a-step-further-understanding-page-spray-in-linux-ke-3f64ce94",
  "class": "SYSTEMS_ADJACENT",
  "score": 3,
  "rationale": "The paper contributes a operating-system and kernel security attack, analysis, or testing artifact with material systems relevance, but its primary contribution is security analysis rather than a new systems design.",
  "topics": [
    "operating-systems-and-kernels",
    "systems-security",
    "linux"
  ],
  "system_layers": [
    "kernel"
  ],
  "contribution_types": [
    "new-mechanism",
    "security-attack",
    "defense"
  ],
  "methods": [],
  "sources": [
    {
      "id": "src-9b987ca9f0f4fec0-paper",
      "url": "https://www.usenix.org/conference/usenixsecurity24/presentation/guo-ziyi",
      "kind": "paper-page",
      "title": "Take a Step Further: Understanding Page Spray in Linux Kernel Exploitation",
      "publisher": "USENIX Association",
      "retrieved_at": "2026-07-30T00:17:50Z",
      "content_hash": null,
      "official": true,
      "supports": [
        "official abstract used for strict systems-relevance screening"
      ]
    }
  ],
  "workflow": {
    "status": "READY_FOR_REVIEW",
    "owner": "agent-d",
    "updated_at": "2026-07-30T00:17:50Z",
    "notes": [
      "Strict systems-relevance screening uses the paper's available abstract and contribution, not venue membership."
    ]
  },
  "verification": {
    "collected_at": "2026-07-30T00:17:50Z",
    "last_verified_at": "2026-07-30T00:17:50Z",
    "collector_version": "agent-d-strict-systems-screen/1.1-paper-review",
    "confidence": "MEDIUM",
    "verified_by": "agent-d",
    "unresolved_fields": []
  }
}
