{
  "$schema": "https://systems-phd-explorer.local/schemas/v1/relevance.schema.json",
  "schema_version": "1.0.0",
  "paper_id": "sp-2026-aespoly-symmetric-key-cryptographic-designs-using-instru-3d6e591e",
  "class": "EXCLUDED",
  "score": 0,
  "rationale": "The primary contribution is a cryptographic primitive, protocol, or proof construction rather than a material computer-system artifact.",
  "topics": [],
  "system_layers": [],
  "contribution_types": [],
  "methods": [],
  "sources": [
    {
      "id": "src-4153dff1b40481b6-publisher",
      "url": "https://www.computer.org/csdl/proceedings-article/sp/2026/606500c466/2geEWbyAPFC",
      "kind": "publisher-page",
      "title": "AESpoly: Symmetric-Key Cryptographic Designs Using Instruction-Level Parallelism between AES and Polynomial Hash",
      "publisher": "IEEE Computer Society",
      "retrieved_at": "2026-07-30T03:19:32Z",
      "content_hash": null,
      "official": true,
      "supports": [
        "publisher abstract used for strict systems-relevance screening"
      ]
    }
  ],
  "workflow": {
    "status": "READY_FOR_REVIEW",
    "owner": "agent-d",
    "updated_at": "2026-07-30T03:19:32Z",
    "notes": [
      "Strict systems-relevance screening used the actual available abstract and primary contribution rather than venue membership."
    ]
  },
  "verification": {
    "collected_at": "2026-07-30T03:19:32Z",
    "last_verified_at": "2026-07-30T03:19:32Z",
    "collector_version": "agent-d-strict-systems-screen/1.1-paper-review",
    "confidence": "HIGH",
    "verified_by": "agent-d",
    "unresolved_fields": []
  }
}
