{
  "$schema": "https://systems-phd-explorer.local/schemas/v1/relevance.schema.json",
  "schema_version": "1.0.0",
  "paper_id": "ndss-2026-janus-enabling-expressive-and-efficient-acls-in-high-spe-1c627c7d",
  "class": "CORE_SYSTEMS",
  "score": 5,
  "rationale": "The paper designs, implements, and evaluates a concrete computer-system architecture or mechanism as its primary contribution.",
  "topics": [
    "systems-security"
  ],
  "system_layers": [
    "runtime",
    "application-infrastructure"
  ],
  "contribution_types": [
    "new-system",
    "new-mechanism"
  ],
  "methods": [
    "implementation"
  ],
  "sources": [
    {
      "id": "src-de6aa2cccb65f98a-paper",
      "url": "https://www.ndss-symposium.org/ndss-paper/janus-enabling-expressive-and-efficient-acls-in-high-speed-rdma-clouds/",
      "kind": "paper-page",
      "title": "Janus: Enabling Expressive and Efficient ACLs in High-speed RDMA Clouds",
      "publisher": "Internet Society",
      "retrieved_at": "2026-07-30T03:19:32Z",
      "content_hash": "sha256:299a743b90f5d7da7683e30758d569976c6841971ca7a0f896332dbb76cfc9b0",
      "official": true,
      "supports": [
        "official abstract used for strict systems-relevance screening"
      ]
    }
  ],
  "workflow": {
    "status": "READY_FOR_REVIEW",
    "owner": "agent-d",
    "updated_at": "2026-07-30T03:19:32Z",
    "notes": [
      "Strict systems-relevance screening used the actual available abstract and primary contribution rather than venue membership."
    ]
  },
  "verification": {
    "collected_at": "2026-07-30T03:19:32Z",
    "last_verified_at": "2026-07-30T03:19:32Z",
    "collector_version": "agent-d-strict-systems-screen/1.1-paper-review",
    "confidence": "HIGH",
    "verified_by": "agent-d",
    "unresolved_fields": []
  }
}
