{
  "$schema": "https://systems-phd-explorer.local/schemas/v1/relevance.schema.json",
  "schema_version": "1.0.0",
  "paper_id": "asplos-2023-flexagon-a-multi-dataflow-sparse-sparse-matrix-multiplic-de16f760",
  "class": "CORE_SYSTEMS",
  "score": 5,
  "rationale": "Core systems fit because Flexagon contributes a concrete tensor-program compilation and acceleration mechanism for a Multi-Dataflow Sparse-Sparse Matrix Multiplication Accelerator for Efficient DNN Processing.",
  "topics": [
    "compilers-languages-and-runtimes",
    "compilers",
    "ml-systems",
    "accelerator-systems",
    "computer-architecture",
    "accelerators"
  ],
  "system_layers": [
    "runtime",
    "hardware"
  ],
  "contribution_types": [
    "optimization"
  ],
  "methods": [
    "implementation",
    "simulation"
  ],
  "sources": [
    {
      "id": "src-asplos-2023-program",
      "url": "https://asplos-conference.org/asplos2023/index.html%3Fp%3D3602.html",
      "kind": "conference-program",
      "title": "Program – ASPLOS 2023",
      "publisher": "ASPLOS",
      "retrieved_at": "2026-07-30T02:00:48Z",
      "content_hash": "sha256:b1f7ebd4f5650ff7bf1046a1bb8140dba70b237cd7059fe48a600e85d9e05435",
      "official": true,
      "supports": [
        "Conference dates, 27 numbered technical sessions, canonical displayed titles, ordered displayed authors, DOI links, and paper-level lightning-talk links."
      ]
    },
    {
      "id": "src-semantic-scholar-3582016-3582069",
      "url": "https://www.semanticscholar.org/paper/2837daee59fa809c7234c2fc3f9ae6340ea0183f",
      "kind": "semantic-scholar",
      "title": "Flexagon: A Multi-dataflow Sparse-Sparse Matrix Multiplication Accelerator for Efficient DNN Processing",
      "publisher": "Semantic Scholar",
      "retrieved_at": "2026-07-30T02:00:48Z",
      "content_hash": "sha256:246356163542f42cc4d7b1c57278873b81f4edfe399dfcccf0cbfe4be66fe2a5",
      "official": false,
      "supports": [
        "Indexed abstract used with the official technical-session context for relevance classification, plus alternate-copy and explicitly printed ancillary links."
      ]
    }
  ],
  "workflow": {
    "status": "READY_FOR_REVIEW",
    "owner": "agent-c",
    "updated_at": "2026-07-30T02:00:48Z",
    "notes": [
      "Classified from the official ASPLOS technical session and the complete abstract indexed by Semantic Scholar; no official conference abstract page was available, and independent review is still required.",
      "The indexed abstract identifies a material architecture, compiler, runtime, communication, scheduling, storage, training, inference, or hardware/software co-design mechanism; the paper was not included merely for proposing or applying a machine-learning algorithm."
    ]
  },
  "verification": {
    "collected_at": "2026-07-30T02:00:48Z",
    "last_verified_at": "2026-07-30T02:00:48Z",
    "collector_version": "agent-c-asplos-2023/1.0",
    "confidence": "HIGH",
    "verified_by": "agent-c",
    "unresolved_fields": []
  }
}
