{
  "$schema": "https://systems-phd-explorer.local/schemas/v1/relevance.schema.json",
  "schema_version": "1.0.0",
  "paper_id": "asplos-2025-forecasting-gpu-performance-for-deep-learning-training-a-c781980c",
  "class": "CORE_SYSTEMS",
  "score": 5,
  "rationale": "Core systems fit because the paper contributes a concrete ML performance, compiler, or accelerator mechanism for forecasting GPU Performance for Deep Learning Training and Inference.",
  "topics": [
    "ml-systems",
    "accelerator-systems",
    "computer-architecture",
    "inference-systems",
    "model-serving",
    "training-systems",
    "compilers-languages-and-runtimes",
    "runtime-systems"
  ],
  "system_layers": [
    "runtime",
    "hardware"
  ],
  "contribution_types": [
    "new-system",
    "optimization",
    "measurement-study"
  ],
  "methods": [
    "implementation"
  ],
  "sources": [
    {
      "id": "src-asplos-2025-program",
      "url": "https://www.asplos-conference.org/asplos2025/program.html",
      "kind": "conference-program",
      "title": "Program – ASPLOS 2025",
      "publisher": "ASPLOS",
      "retrieved_at": "2026-07-29T23:57:17Z",
      "content_hash": "sha256:3e75b3f4843c2de86e1da2f4872d2aa4d16e08296ab26f9f24a3f10227597dd2",
      "official": true,
      "supports": [
        "ASPLOS 2025 dates, numbered technical sessions, program titles, ordered authors, affiliations, and DOI links."
      ]
    },
    {
      "id": "src-semantic-scholar-3669940-3707265",
      "url": "https://www.semanticscholar.org/paper/a7ed53a0b332bfe629053d986e0e099d2131c899",
      "kind": "semantic-scholar",
      "title": "Forecasting GPU Performance for Deep Learning Training and Inference",
      "publisher": "Semantic Scholar",
      "retrieved_at": "2026-07-29T23:57:17Z",
      "content_hash": "sha256:5aad2abd4103980eb67d428b6033dda4a26170c610c810e0bb1bbd0832a70b32",
      "official": false,
      "supports": [
        "Indexed abstract and open-access links used for relevance classification and ancillary-link discovery."
      ]
    }
  ],
  "workflow": {
    "status": "READY_FOR_REVIEW",
    "owner": "agent-c",
    "updated_at": "2026-07-29T23:57:17Z",
    "notes": [
      "Classified from the official program session and an abstract indexed by Semantic Scholar; independent review is still required.",
      "The abstract identifies a concrete architecture, compiler, runtime, scheduling, serving, training, or hardware/software co-design mechanism; the paper was not included merely for applying machine learning."
    ]
  },
  "verification": {
    "collected_at": "2026-07-29T23:57:17Z",
    "last_verified_at": "2026-07-29T23:57:17Z",
    "collector_version": "agent-c-asplos-2025/1.0",
    "confidence": "HIGH",
    "verified_by": "agent-c",
    "unresolved_fields": []
  }
}
