{
  "$schema": "https://systems-phd-explorer.local/schemas/v1/relevance.schema.json",
  "schema_version": "1.0.0",
  "paper_id": "ndss-2026-paladin-defending-llm-enabled-phishing-emails-with-a-new-978ab866",
  "class": "EXCLUDED",
  "score": 0,
  "rationale": "The primary contribution is an ML-model attack or defense without a compiler, runtime, serving, architecture, or other material systems artifact.",
  "topics": [],
  "system_layers": [],
  "contribution_types": [
    "new-mechanism",
    "optimization",
    "language-or-api"
  ],
  "methods": [],
  "sources": [
    {
      "id": "src-2b06409eb791eac3-paper",
      "url": "https://www.ndss-symposium.org/ndss-paper/paladin-defending-llm-enabled-phishing-emails-with-a-new-trigger-tag-paradigm/",
      "kind": "paper-page",
      "title": "Paladin: Defending LLM-enabled Phishing Emails with a New Trigger-Tag Paradigm",
      "publisher": "Internet Society",
      "retrieved_at": "2026-07-30T03:19:32Z",
      "content_hash": "sha256:5ba3fd2b8496f8782f4ecbad5b9c1898e988bf728a58ca58eaf26cfb4aded32d",
      "official": true,
      "supports": [
        "official abstract used for strict systems-relevance screening"
      ]
    }
  ],
  "workflow": {
    "status": "READY_FOR_REVIEW",
    "owner": "agent-d",
    "updated_at": "2026-07-30T03:19:32Z",
    "notes": [
      "Strict systems-relevance screening used the actual available abstract and primary contribution rather than venue membership."
    ]
  },
  "verification": {
    "collected_at": "2026-07-30T03:19:32Z",
    "last_verified_at": "2026-07-30T03:19:32Z",
    "collector_version": "agent-d-strict-systems-screen/1.1-paper-review",
    "confidence": "HIGH",
    "verified_by": "agent-d",
    "unresolved_fields": []
  }
}
