{
  "$schema": "https://systems-phd-explorer.local/schemas/v1/relevance.schema.json",
  "schema_version": "1.0.0",
  "paper_id": "asplos-2026-arm-weak-memory-consistency-on-apple-silicon-what-is-it-e750195d",
  "class": "CORE_SYSTEMS",
  "score": 5,
  "rationale": "Core systems fit: “Arm Weak Memory Consistency on Apple Silicon: What Is It Good For?” is an implemented and evaluated processor microarchitecture, measurement, or execution-orchestration mechanism.",
  "topics": [
    "processors",
    "memory-hierarchy",
    "workload-characterization"
  ],
  "system_layers": [
    "hardware",
    "firmware"
  ],
  "contribution_types": [
    "new-mechanism",
    "measurement-study"
  ],
  "methods": [
    "implementation",
    "trace-analysis"
  ],
  "sources": [
    {
      "id": "src-asplos-2026-program",
      "url": "https://www.asplos-conference.org/asplos2026/program/index.html",
      "kind": "conference-program",
      "title": "Program – ASPLOS 2026",
      "publisher": "ASPLOS",
      "retrieved_at": "2026-07-30T03:22:35Z",
      "content_hash": "sha256:58470e84dffaaad19c0c93f7b7270735f720815f4da0d047d74609031a96b037",
      "official": true,
      "supports": [
        "Detailed ASPLOS 2026 boundary, 36 numbered technical sessions, 168 unique paper titles, and displayed author lists."
      ]
    },
    {
      "id": "src-semantic-scholar-3779212-3790129",
      "url": "https://www.semanticscholar.org/paper/1113e69674ef97c2cd4713e80a2d6ddc4d3a1939",
      "kind": "semantic-scholar",
      "title": "Arm Weak Memory Consistency on Apple Silicon: What Is It Good For?",
      "publisher": "Semantic Scholar",
      "retrieved_at": "2026-07-30T03:22:35Z",
      "content_hash": "sha256:11746aae5ddd228c690344bf38a03f83f984dda70159f2b5a98bee9b00f2d958",
      "official": false,
      "supports": [
        "Indexed abstract used for strict relevance classification and indexed arXiv identifier where available."
      ]
    }
  ],
  "workflow": {
    "status": "READY_FOR_REVIEW",
    "owner": "agent-c",
    "updated_at": "2026-07-30T03:22:35Z",
    "notes": [
      "Classified from the official technical session and a paper abstract under the strict ASPLOS systems-mechanism rule; independent review is still required."
    ]
  },
  "verification": {
    "collected_at": "2026-07-30T03:22:35Z",
    "last_verified_at": "2026-07-30T03:22:35Z",
    "collector_version": "agent-c-asplos-2026/1.0",
    "confidence": "HIGH",
    "verified_by": "agent-c",
    "unresolved_fields": []
  }
}
