{
  "$schema": "https://systems-phd-explorer.local/schemas/v1/relevance.schema.json",
  "schema_version": "1.0.0",
  "paper_id": "usenix-security-2024-a-decade-of-privacy-relevant-android-app-reviews-large-s-140f2889",
  "class": "SYSTEMS_ADJACENT",
  "score": 3,
  "rationale": "The paper builds a large-scale longitudinal analysis pipeline for privacy-relevant Android app reviews and ecosystem trends.",
  "topics": [
    "privacy-systems",
    "measurement-and-empirical-systems-studies"
  ],
  "system_layers": [
    "application-infrastructure"
  ],
  "contribution_types": [],
  "methods": [],
  "sources": [
    {
      "id": "src-510cad595361afb9-paper",
      "url": "https://www.usenix.org/conference/usenixsecurity24/presentation/akgul",
      "kind": "paper-page",
      "title": "A Decade of Privacy-Relevant Android App Reviews: Large Scale Trends",
      "publisher": "USENIX Association",
      "retrieved_at": "2026-07-30T00:17:50Z",
      "content_hash": null,
      "official": true,
      "supports": [
        "official abstract used for strict systems-relevance screening"
      ]
    }
  ],
  "workflow": {
    "status": "READY_FOR_REVIEW",
    "owner": "agent-d",
    "updated_at": "2026-07-30T00:17:50Z",
    "notes": [
      "Strict systems-relevance screening uses the paper's available abstract and contribution, not venue membership."
    ]
  },
  "verification": {
    "collected_at": "2026-07-30T00:17:50Z",
    "last_verified_at": "2026-07-30T00:17:50Z",
    "collector_version": "agent-d-strict-systems-screen/1.1-paper-review",
    "confidence": "HIGH",
    "verified_by": "agent-d",
    "unresolved_fields": []
  }
}
