{
  "$schema": "https://systems-phd-explorer.local/schemas/v1/relevance.schema.json",
  "schema_version": "1.0.0",
  "paper_id": "asplos-2026-falcon-algorithm-hardware-co-design-for-efficient-fully-7fa6ec39",
  "class": "CORE_SYSTEMS",
  "score": 5,
  "rationale": "Core systems fit: Falcon is an implemented and evaluated fully homomorphic encryption compiler, GPU library, or accelerator mechanism.",
  "topics": [
    "private-computation",
    "accelerators",
    "hardware-software-co-design",
    "compilers"
  ],
  "system_layers": [
    "hardware",
    "runtime"
  ],
  "contribution_types": [
    "new-system",
    "optimization"
  ],
  "methods": [
    "implementation",
    "hardware-prototype"
  ],
  "sources": [
    {
      "id": "src-asplos-2026-program",
      "url": "https://www.asplos-conference.org/asplos2026/program/index.html",
      "kind": "conference-program",
      "title": "Program – ASPLOS 2026",
      "publisher": "ASPLOS",
      "retrieved_at": "2026-07-30T03:22:35Z",
      "content_hash": "sha256:58470e84dffaaad19c0c93f7b7270735f720815f4da0d047d74609031a96b037",
      "official": true,
      "supports": [
        "Detailed ASPLOS 2026 boundary, 36 numbered technical sessions, 168 unique paper titles, and displayed author lists."
      ]
    },
    {
      "id": "src-semantic-scholar-3779212-3790160",
      "url": "https://www.semanticscholar.org/paper/eb38389aa2320bb9c6e7ec4e49dda80e580f19a8",
      "kind": "semantic-scholar",
      "title": "Falcon: Algorithm-Hardware Co-Design for Efficient Fully Homomorphic Encryption Accelerator",
      "publisher": "Semantic Scholar",
      "retrieved_at": "2026-07-30T03:22:35Z",
      "content_hash": "sha256:2e80d55cd596c97e54c5712d3e25cb68611edfe66028b156f93adbcca7a370f7",
      "official": false,
      "supports": [
        "Indexed abstract used for strict relevance classification and indexed arXiv identifier where available."
      ]
    }
  ],
  "workflow": {
    "status": "READY_FOR_REVIEW",
    "owner": "agent-c",
    "updated_at": "2026-07-30T03:22:35Z",
    "notes": [
      "Classified from the official technical session and a paper abstract under the strict ASPLOS systems-mechanism rule; independent review is still required."
    ]
  },
  "verification": {
    "collected_at": "2026-07-30T03:22:35Z",
    "last_verified_at": "2026-07-30T03:22:35Z",
    "collector_version": "agent-c-asplos-2026/1.0",
    "confidence": "HIGH",
    "verified_by": "agent-c",
    "unresolved_fields": []
  }
}
