{
  "$schema": "https://systems-phd-explorer.local/schemas/v1/relevance.schema.json",
  "schema_version": "1.0.0",
  "paper_id": "asplos-2023-caqr-a-compiler-assisted-approach-for-qubit-reuse-throug-0f6c338d",
  "class": "CORE_SYSTEMS",
  "score": 4,
  "rationale": "Core systems fit because CaQR contributes a concrete quantum architecture and execution mechanism for a Compiler-assisted Approach for Qubit Reuse Through Dynamic Circuit.",
  "topics": [
    "computer-architecture",
    "accelerators",
    "compilers-languages-and-runtimes",
    "compilers"
  ],
  "system_layers": [
    "hardware",
    "runtime"
  ],
  "contribution_types": [
    "new-system",
    "new-mechanism",
    "language-or-api"
  ],
  "methods": [
    "implementation",
    "simulation",
    "trace-analysis"
  ],
  "sources": [
    {
      "id": "src-asplos-2023-program",
      "url": "https://asplos-conference.org/asplos2023/index.html%3Fp%3D3602.html",
      "kind": "conference-program",
      "title": "Program – ASPLOS 2023",
      "publisher": "ASPLOS",
      "retrieved_at": "2026-07-30T02:00:48Z",
      "content_hash": "sha256:b1f7ebd4f5650ff7bf1046a1bb8140dba70b237cd7059fe48a600e85d9e05435",
      "official": true,
      "supports": [
        "Conference dates, 27 numbered technical sessions, canonical displayed titles, ordered displayed authors, DOI links, and paper-level lightning-talk links."
      ]
    },
    {
      "id": "src-semantic-scholar-3582016-3582030",
      "url": "https://www.semanticscholar.org/paper/9ad3613d7940b2964174844abf65271ed6700619",
      "kind": "semantic-scholar",
      "title": "CaQR: A Compiler-Assisted Approach for Qubit Reuse through Dynamic Circuit",
      "publisher": "Semantic Scholar",
      "retrieved_at": "2026-07-30T02:00:48Z",
      "content_hash": "sha256:b5b241a7bd80f179fdc196755a48c69aaf298314d3af9696dadda9922d4ab71d",
      "official": false,
      "supports": [
        "Indexed abstract used with the official technical-session context for relevance classification, plus alternate-copy and explicitly printed ancillary links."
      ]
    }
  ],
  "workflow": {
    "status": "READY_FOR_REVIEW",
    "owner": "agent-c",
    "updated_at": "2026-07-30T02:00:48Z",
    "notes": [
      "Classified from the official ASPLOS technical session and the complete abstract indexed by Semantic Scholar; no official conference abstract page was available, and independent review is still required."
    ]
  },
  "verification": {
    "collected_at": "2026-07-30T02:00:48Z",
    "last_verified_at": "2026-07-30T02:00:48Z",
    "collector_version": "agent-c-asplos-2023/1.0",
    "confidence": "HIGH",
    "verified_by": "agent-c",
    "unresolved_fields": []
  }
}
