{
  "$schema": "https://systems-phd-explorer.local/schemas/v1/relevance.schema.json",
  "schema_version": "1.0.0",
  "paper_id": "usenix-security-2026-ddr-sse-duplicated-retrieval-of-documents-for-system-wid-67106ddb",
  "class": "EXCLUDED",
  "score": 0,
  "rationale": "The primary contribution is a cryptographic primitive, protocol, or proof construction rather than a material computer-system artifact.",
  "topics": [],
  "system_layers": [],
  "contribution_types": [],
  "methods": [],
  "sources": [
    {
      "id": "src-c06ba7306706505e-paper",
      "url": "https://www.usenix.org/conference/usenixsecurity26/presentation/gui",
      "kind": "paper-page",
      "title": "DDR-SSE: Duplicated Retrieval of Documents for System-wide Secure Searchable Symmetric Encryption",
      "publisher": "USENIX Association",
      "retrieved_at": "2026-07-30T03:19:32Z",
      "content_hash": "sha256:fa69502465fcb23f803c8d95ca841242f0ed777dcd15c51a19c258827666a6a9",
      "official": true,
      "supports": [
        "official abstract used for strict systems-relevance screening"
      ]
    }
  ],
  "workflow": {
    "status": "READY_FOR_REVIEW",
    "owner": "agent-d",
    "updated_at": "2026-07-30T03:19:32Z",
    "notes": [
      "Strict systems-relevance screening used the actual available abstract and primary contribution rather than venue membership."
    ]
  },
  "verification": {
    "collected_at": "2026-07-30T03:19:32Z",
    "last_verified_at": "2026-07-30T03:19:32Z",
    "collector_version": "agent-d-strict-systems-screen/1.1-paper-review",
    "confidence": "HIGH",
    "verified_by": "agent-d",
    "unresolved_fields": []
  }
}
