{
  "$schema": "https://systems-phd-explorer.local/schemas/v1/relevance.schema.json",
  "schema_version": "1.0.0",
  "paper_id": "usenix-security-2023-lightthief-your-optical-communication-information-is-sto-8f800e64",
  "class": "SYSTEMS_ADJACENT",
  "score": 2,
  "rationale": "The paper presents a concrete security analysis or tool, but the available abstract does not place its primary contribution within a core systems area.",
  "topics": [
    "systems-security"
  ],
  "system_layers": [],
  "contribution_types": [
    "new-system",
    "security-attack",
    "defense"
  ],
  "methods": [],
  "sources": [
    {
      "id": "src-67d76605dd837212-paper",
      "url": "https://www.usenix.org/conference/usenixsecurity23/presentation/liu-xin",
      "kind": "paper-page",
      "title": "LightThief: Your Optical Communication Information is Stolen behind the Wall",
      "publisher": "USENIX Association",
      "retrieved_at": "2026-07-30T01:39:19Z",
      "content_hash": null,
      "official": true,
      "supports": [
        "official abstract used for strict systems-relevance screening"
      ]
    }
  ],
  "workflow": {
    "status": "READY_FOR_REVIEW",
    "owner": "agent-d",
    "updated_at": "2026-07-30T01:39:19Z",
    "notes": [
      "Strict systems-relevance screening uses the paper's available abstract and contribution, not venue membership."
    ]
  },
  "verification": {
    "collected_at": "2026-07-30T01:39:19Z",
    "last_verified_at": "2026-07-30T01:39:19Z",
    "collector_version": "agent-d-strict-systems-screen/1.2-paper-review",
    "confidence": "LOW",
    "verified_by": "agent-d",
    "unresolved_fields": []
  }
}
