{
  "$schema": "https://systems-phd-explorer.local/schemas/v1/relevance.schema.json",
  "schema_version": "1.0.0",
  "paper_id": "ndss-2024-modeling-and-detecting-internet-censorship-events-20ec931d",
  "class": "CORE_SYSTEMS",
  "score": 4,
  "rationale": "The paper's primary contribution is a network security system or mechanism with a concrete systems artifact.",
  "topics": [
    "networking",
    "network-security"
  ],
  "system_layers": [
    "network"
  ],
  "contribution_types": [
    "new-system",
    "measurement-study",
    "defense"
  ],
  "methods": [
    "implementation"
  ],
  "sources": [
    {
      "id": "src-99b1d661680a62f3-paper",
      "url": "https://www.ndss-symposium.org/ndss-paper/modeling-and-detecting-internet-censorship-events/",
      "kind": "paper-page",
      "title": "Modeling and Detecting Internet Censorship Events",
      "publisher": "Internet Society",
      "retrieved_at": "2026-07-30T00:17:50Z",
      "content_hash": null,
      "official": true,
      "supports": [
        "official abstract used for strict systems-relevance screening"
      ]
    }
  ],
  "workflow": {
    "status": "READY_FOR_REVIEW",
    "owner": "agent-d",
    "updated_at": "2026-07-30T00:17:50Z",
    "notes": [
      "Strict systems-relevance screening uses the paper's available abstract and contribution, not venue membership."
    ]
  },
  "verification": {
    "collected_at": "2026-07-30T00:17:50Z",
    "last_verified_at": "2026-07-30T00:17:50Z",
    "collector_version": "agent-d-strict-systems-screen/1.1-paper-review",
    "confidence": "MEDIUM",
    "verified_by": "agent-d",
    "unresolved_fields": []
  }
}
