{
  "$schema": "https://systems-phd-explorer.local/schemas/v1/relevance.schema.json",
  "schema_version": "1.0.0",
  "paper_id": "ndss-2024-faults-in-our-bus-novel-bus-fault-attack-to-break-arm-tr-ea6a04f1",
  "class": "SYSTEMS_ADJACENT",
  "score": 3,
  "rationale": "The paper contributes a operating-system and kernel security attack, analysis, or testing artifact with material systems relevance, but its primary contribution is security analysis rather than a new systems design.",
  "topics": [
    "operating-systems-and-kernels",
    "systems-security",
    "virtualization-and-isolation",
    "isolation",
    "confidential-computing",
    "trusted-execution-environments",
    "computer-architecture",
    "hardware-security",
    "side-channels",
    "mobile-edge-embedded-and-iot"
  ],
  "system_layers": [
    "kernel",
    "hypervisor",
    "runtime",
    "hardware",
    "firmware",
    "application-infrastructure"
  ],
  "contribution_types": [
    "new-system",
    "language-or-api",
    "security-attack"
  ],
  "methods": [
    "implementation"
  ],
  "sources": [
    {
      "id": "src-c6d529be29df0344-paper",
      "url": "https://www.ndss-symposium.org/ndss-paper/faults-in-our-bus-novel-bus-fault-attack-to-break-arm-trustzone/",
      "kind": "paper-page",
      "title": "Faults in Our Bus: Novel Bus Fault Attack to Break ARM TrustZone",
      "publisher": "Internet Society",
      "retrieved_at": "2026-07-30T00:17:50Z",
      "content_hash": null,
      "official": true,
      "supports": [
        "official abstract used for strict systems-relevance screening"
      ]
    }
  ],
  "workflow": {
    "status": "READY_FOR_REVIEW",
    "owner": "agent-d",
    "updated_at": "2026-07-30T00:17:50Z",
    "notes": [
      "Strict systems-relevance screening uses the paper's available abstract and contribution, not venue membership."
    ]
  },
  "verification": {
    "collected_at": "2026-07-30T00:17:50Z",
    "last_verified_at": "2026-07-30T00:17:50Z",
    "collector_version": "agent-d-strict-systems-screen/1.1-paper-review",
    "confidence": "MEDIUM",
    "verified_by": "agent-d",
    "unresolved_fields": []
  }
}
