{
  "$schema": "https://systems-phd-explorer.local/schemas/v1/relevance.schema.json",
  "schema_version": "1.0.0",
  "paper_id": "asplos-2024-optimizing-dynamic-shape-neural-networks-on-accelerators-e20aa44b",
  "class": "CORE_SYSTEMS",
  "score": 5,
  "rationale": "Core systems fit because the paper contributes a concrete sparse and dynamic-shape ML execution mechanism, evaluated in the ASPLOS paper “Optimizing Dynamic-Shape Neural Networks on Accelerators via On-the-Fly Micro-Kernel Polymerization.”",
  "topics": [
    "ml-systems",
    "compilers-languages-and-runtimes",
    "compilers",
    "accelerator-systems"
  ],
  "system_layers": [
    "runtime",
    "hardware"
  ],
  "contribution_types": [
    "optimization"
  ],
  "methods": [
    "implementation"
  ],
  "sources": [
    {
      "id": "src-asplos-2024-program",
      "url": "https://www.asplos-conference.org/asplos2024/main-program/index.html",
      "kind": "conference-program",
      "title": "Main Program – ASPLOS 2024",
      "publisher": "ASPLOS",
      "retrieved_at": "2026-07-30T01:41:45Z",
      "content_hash": "sha256:334dc53de887a38eee13a2233e1205effbd373f903a1bfef8d1a191f80de2b33",
      "official": true,
      "supports": [
        "ASPLOS 2024 technical-session boundaries, canonical displayed titles, ordered displayed authors, DOI links, award labels, and lightning-talk links."
      ]
    },
    {
      "id": "src-asplos-2024-abstracts",
      "url": "https://www.asplos-conference.org/asplos2024/main-program/abstracts/index.html",
      "kind": "conference-program",
      "title": "Paper Abstracts – ASPLOS 2024",
      "publisher": "ASPLOS",
      "retrieved_at": "2026-07-30T01:41:45Z",
      "content_hash": "sha256:efbeff4ba534349925c858f34b895fed7269f857c85df9e81b64aefdc9d9c722",
      "official": true,
      "supports": [
        "Official abstracts for all 193 main-program papers and ancillary URLs explicitly printed in those abstracts."
      ]
    }
  ],
  "workflow": {
    "status": "READY_FOR_REVIEW",
    "owner": "agent-c",
    "updated_at": "2026-07-30T01:41:45Z",
    "notes": [
      "Classified from the official ASPLOS technical session and official conference abstract; independent review is still required.",
      "The official abstract identifies a material architecture, compiler, runtime, communication, scheduling, serving, training-system, or hardware/software co-design mechanism; the paper was not included merely for applying machine learning."
    ]
  },
  "verification": {
    "collected_at": "2026-07-30T01:41:45Z",
    "last_verified_at": "2026-07-30T01:41:45Z",
    "collector_version": "agent-c-asplos-2024/1.0",
    "confidence": "HIGH",
    "verified_by": "agent-c",
    "unresolved_fields": []
  }
}
