{
  "$schema": "https://systems-phd-explorer.local/schemas/v1/relevance.schema.json",
  "schema_version": "1.0.0",
  "paper_id": "ndss-2024-drainclog-detecting-rogue-accounts-with-illegally-obtain-0a502b8a",
  "class": "EXCLUDED",
  "score": 0,
  "rationale": "The primary contribution is an ML-model attack or defense without a compiler, runtime, serving, architecture, or other material systems artifact.",
  "topics": [],
  "system_layers": [],
  "contribution_types": [],
  "methods": [],
  "sources": [
    {
      "id": "src-374e7e25b4c7579d-paper",
      "url": "https://www.ndss-symposium.org/ndss-paper/drainclog-detecting-rogue-accounts-with-illegally-obtained-nfts-using-classifiers-learned-on-graphs/",
      "kind": "paper-page",
      "title": "DRAINCLoG: Detecting Rogue Accounts with Illegally-obtained NFTs using Classifiers Learned on Graphs",
      "publisher": "Internet Society",
      "retrieved_at": "2026-07-30T00:17:50Z",
      "content_hash": null,
      "official": true,
      "supports": [
        "official abstract used for strict systems-relevance screening"
      ]
    }
  ],
  "workflow": {
    "status": "READY_FOR_REVIEW",
    "owner": "agent-d",
    "updated_at": "2026-07-30T00:17:50Z",
    "notes": [
      "Strict systems-relevance screening uses the paper's available abstract and contribution, not venue membership."
    ]
  },
  "verification": {
    "collected_at": "2026-07-30T00:17:50Z",
    "last_verified_at": "2026-07-30T00:17:50Z",
    "collector_version": "agent-d-strict-systems-screen/1.1-paper-review",
    "confidence": "HIGH",
    "verified_by": "agent-d",
    "unresolved_fields": []
  }
}
