{
  "$schema": "https://systems-phd-explorer.local/schemas/v1/relevance.schema.json",
  "schema_version": "1.0.0",
  "paper_id": "ccs-2024-tokenscout-early-detection-of-ethereum-scam-tokens-via-t-336e61b5",
  "class": "EXCLUDED",
  "score": 0,
  "rationale": "The primary contribution is an ML-model attack or defense without a compiler, runtime, serving, architecture, or other material systems artifact.",
  "topics": [],
  "system_layers": [],
  "contribution_types": [
    "dataset"
  ],
  "methods": [],
  "sources": [
    {
      "id": "src-866f8049386cb1ff-publisher",
      "url": "https://doi.org/10.1145/3658644.3690234",
      "kind": "publisher-page",
      "title": "TokenScout: Early Detection of Ethereum Scam Tokens via Temporal Graph Learning",
      "publisher": "Association for Computing Machinery",
      "retrieved_at": "2026-07-30T00:17:50Z",
      "content_hash": null,
      "official": true,
      "supports": [
        "paper identity and official publication"
      ]
    },
    {
      "id": "src-b3affb1ae6f8963d-abstract",
      "url": "https://www.semanticscholar.org/paper/b28ba982c3736257136c27387eb1367e78b188d7",
      "kind": "semantic-scholar",
      "title": "TokenScout: Early Detection of Ethereum Scam Tokens via Temporal Graph Learning",
      "publisher": "Semantic Scholar",
      "retrieved_at": "2026-07-30T00:17:50Z",
      "content_hash": null,
      "official": false,
      "supports": [
        "abstract used for strict systems-relevance screening"
      ]
    }
  ],
  "workflow": {
    "status": "READY_FOR_REVIEW",
    "owner": "agent-d",
    "updated_at": "2026-07-30T00:17:50Z",
    "notes": [
      "Strict systems-relevance screening uses the paper's available abstract and contribution, not venue membership."
    ]
  },
  "verification": {
    "collected_at": "2026-07-30T00:17:50Z",
    "last_verified_at": "2026-07-30T00:17:50Z",
    "collector_version": "agent-d-strict-systems-screen/1.1-paper-review",
    "confidence": "HIGH",
    "verified_by": "agent-d",
    "unresolved_fields": []
  }
}
