{
  "$schema": "https://systems-phd-explorer.local/schemas/v1/relevance.schema.json",
  "schema_version": "1.0.0",
  "paper_id": "usenix-security-2025-subverting-the-secure-vm-by-exploiting-pcie-devices-58191f98",
  "class": "NEEDS_HUMAN_REVIEW",
  "score": 0,
  "rationale": "The available record lacks an abstract, so the paper's systems artifact cannot be established from the title alone.",
  "topics": [],
  "system_layers": [],
  "contribution_types": [],
  "methods": [],
  "sources": [
    {
      "id": "src-57efc7c17ce0d1f5-dblp",
      "url": "https://dblp.org/rec/conf/uss/Myung0L25",
      "kind": "dblp",
      "title": "Subverting the Secure VM by Exploiting PCIe Devices",
      "publisher": "DBLP",
      "retrieved_at": "2026-07-29T23:46:51Z",
      "content_hash": null,
      "official": false,
      "supports": [
        "title-only proceedings evidence; official abstract unavailable"
      ]
    }
  ],
  "workflow": {
    "status": "READY_FOR_REVIEW",
    "owner": "agent-d",
    "updated_at": "2026-07-29T23:46:51Z",
    "notes": [
      "Strict systems-relevance screening uses the paper's available abstract and contribution, not venue membership.",
      "No automatic inclusion or exclusion was inferred across an unresolved boundary."
    ]
  },
  "verification": {
    "collected_at": "2026-07-29T23:46:51Z",
    "last_verified_at": "2026-07-29T23:46:51Z",
    "collector_version": "agent-d-strict-systems-screen/1.0",
    "confidence": "UNRESOLVED",
    "verified_by": "agent-d",
    "unresolved_fields": [
      "classification requires abstract or paper review"
    ]
  }
}
